{
  "$schema": "https://json-schema.org/draft/2020-12/schema",
  "$id": "https://github.com/stranske/Workflows/docs/contracts/schemas/run-contract-v1.schema.json",
  "title": "Research Backplane Run Envelope v1",
  "type": "object",
  "additionalProperties": true,
  "required": [
    "schema_version",
    "repo",
    "tool",
    "run_id",
    "status",
    "actor",
    "inputs",
    "outputs",
    "provenance",
    "github_issue"
  ],
  "properties": {
    "schema_version": {
      "const": "run-contract/v1"
    },
    "repo": {
      "type": "string",
      "minLength": 1
    },
    "tool": {
      "type": "string",
      "minLength": 1
    },
    "run_id": {
      "type": "string",
      "minLength": 1
    },
    "status": {
      "type": "string",
      "enum": [
        "success",
        "error",
        "partial",
        "fallback",
        "skipped"
      ]
    },
    "github_issue": {
      "type": "string",
      "minLength": 1
    },
    "actor": {
      "type": "object",
      "additionalProperties": true,
      "required": [
        "kind",
        "id"
      ],
      "properties": {
        "kind": {
          "type": "string",
          "enum": [
            "human",
            "agent",
            "schedule",
            "recipe",
            "ci"
          ]
        },
        "id": {
          "type": "string",
          "minLength": 1
        },
        "intent": {
          "type": "string",
          "minLength": 1
        },
        "correlation_id": {
          "type": "string",
          "minLength": 1
        }
      }
    },
    "inputs": {
      "type": "object",
      "additionalProperties": true,
      "required": [
        "validated"
      ],
      "properties": {
        "validated": {
          "type": "boolean"
        },
        "refs": {
          "type": "array",
          "items": {
            "type": "string",
            "pattern": "^(sha256:|hash:|artifact:|ref:).+"
          }
        },
        "summary": {
          "type": "object"
        }
      }
    },
    "outputs": {
      "type": "object",
      "additionalProperties": true,
      "required": [
        "manifest_ref"
      ],
      "properties": {
        "manifest_ref": {
          "type": "string",
          "minLength": 1,
          "description": "artifact:manifest.json or a traversal-safe run-dir-relative POSIX path.",
          "pattern": "^(?:artifact:manifest\\.json|(?!(?:/|[A-Za-z]:))(?!.*\\\\)(?!.*(?:^|/)\\.\\.(?:/|$))(?!.*//)(?!.*:)(?!.*\\/$).+)$"
        },
        "summary": {
          "type": "object"
        },
        "artifact_ids": {
          "type": "array",
          "items": {
            "type": "string",
            "minLength": 1
          }
        }
      }
    },
    "provenance": {
      "type": "object",
      "additionalProperties": true,
      "required": [
        "tool_version"
      ],
      "properties": {
        "tool_version": {
          "type": "string",
          "minLength": 1
        },
        "git_sha": {
          "type": ["string", "null"]
        },
        "python_version": {
          "type": "string",
          "minLength": 1
        },
        "platform": {
          "type": "string",
          "minLength": 1
        },
        "code_version": {
          "type": "string",
          "minLength": 1
        }
      }
    },
    "cost": {
      "type": "object",
      "additionalProperties": true,
      "properties": {
        "usd": {
          "type": ["number", "null"],
          "minimum": 0
        },
        "input_tokens": {
          "type": "integer",
          "minimum": 0
        },
        "output_tokens": {
          "type": "integer",
          "minimum": 0
        }
      }
    },
    "latency": {
      "type": "object",
      "additionalProperties": true,
      "properties": {
        "wall_ms": {
          "type": "number",
          "minimum": 0
        },
        "peak_mem_mb": {
          "type": "number",
          "minimum": 0
        }
      }
    },
    "warnings": {
      "type": "array",
      "items": {
        "type": "object",
        "additionalProperties": true,
        "required": [
          "code",
          "severity",
          "message"
        ],
        "properties": {
          "code": {
            "type": "string",
            "minLength": 1
          },
          "severity": {
            "type": "string",
            "enum": [
              "info",
              "warning",
              "error"
            ]
          },
          "message": {
            "type": "string",
            "minLength": 1
          },
          "context": {
            "type": "object"
          }
        }
      }
    },
    "data_quality": {
      "type": "object",
      "additionalProperties": true,
      "properties": {
        "overall_status": {
          "type": "string",
          "enum": [
            "ok",
            "info",
            "warn",
            "fail"
          ]
        },
        "dropped_rows": {
          "type": "integer",
          "minimum": 0
        },
        "coerced_rows": {
          "type": "integer",
          "minimum": 0
        },
        "conflict": {
          "type": "boolean"
        },
        "findings": {
          "type": "array",
          "items": {
            "type": "object"
          }
        }
      }
    },
    "evidence_refs": {
      "type": "array",
      "items": {
        "type": "string",
        "minLength": 1
      }
    },
    "identity_refs": {
      "type": "array",
      "items": {
        "type": "string",
        "pattern": "^[a-z0-9_]+:[a-z0-9][a-z0-9_.:-]*$"
      }
    },
    "langsmith": {
      "type": "object",
      "additionalProperties": true,
      "properties": {
        "trace_id": {
          "type": "string",
          "minLength": 1
        },
        "trace_url": {
          "type": "string",
          "minLength": 1
        }
      }
    },
    "recorded_at": {
      "type": "string",
      "format": "date-time"
    },
    "parent_run_id": {
      "type": "string",
      "minLength": 1
    }
  }
}
