{
  "schema_version": "run-contract/v1",
  "repo": "stranske/Pension-Data",
  "tool": "one-pdf-pilot",
  "run_id": "sha256:0f0e0d0c0b0a09080706050403020100ffeeddccbbaa99887766554433221100",
  "status": "success",
  "github_issue": "stranske/Workflows#TBD-P0",
  "actor": {
    "kind": "ci",
    "id": "backplane-fixture",
    "intent": "INVALID: inlines raw SQL result rows in outputs.summary"
  },
  "inputs": {
    "validated": true
  },
  "outputs": {
    "manifest_ref": "artifact:manifest.json",
    "summary": {
      "rows": [
        {"member": "Jane Doe", "ssn": "000-00-0000", "balance": 12345.67}
      ]
    },
    "artifact_ids": []
  },
  "provenance": {
    "tool_version": "0.1.0"
  },
  "cost": {
    "usd": null,
    "input_tokens": 0,
    "output_tokens": 0
  },
  "latency": {
    "wall_ms": 12.0
  },
  "warnings": [],
  "data_quality": {
    "overall_status": "ok"
  },
  "evidence_refs": [],
  "identity_refs": []
}
